root@Comp3134-Winter2023:~/wk3# tcpdump -n -i eth0
tcpdump: verbose output suppressed, use -v or -vv for full protocol decode
listening on eth0, link-type EN10MB (Ethernet), capture size 262144 bytes
19:11:32.457466 IP 146.190.248.226.22 > 157.49.197.53.42950: Flags [P.], seq 147474423:147474531, ack 4018969336, win 501, options [nop,nop,TS val 3594836027 ecr 3463962692], length 108
19:11:32.457561 IP 146.190.248.226.22 > 157.49.197.53.42950: Flags [P.], seq 108:252, ack 1, win 501, options [nop,nop,TS val 3594836027 ecr 3463962692], length 144
19:11:32.457649 IP 146.190.248.226.22 > 157.49.197.53.42950: Flags [P.], seq 252:288, ack 1, win 501, options [nop,nop,TS val 3594836027 ecr 3463962692], length 36
19:11:32.457794 IP 146.190.248.226.22 > 157.49.197.53.42950: Flags [P.], seq 288:508, ack 1, win 501, options [nop,nop,TS val 3594836027 ecr 3463962692], length 220
19:11:32.457909 IP 146.190.248.226.22 > 157.49.197.53.42950: Flags [P.], seq 508:988, ack 1, win 501, options [nop,nop,TS val 3594836027 ecr 3463962692], length 480
19:11:32.458012 IP 146.190.248.226.22 > 157.49.197.53.42950: Flags [P.], seq 988:1264, ack 1, win 501, options [nop,nop,TS val 3594836027 ecr 3463962692], length 276
19:11:32.458065 IP 146.190.248.226.22 > 157.49.197.53.42950: Flags [P.], seq 1264:1468, ack 1, win 501, options [nop,nop,TS val 3594836027 ecr 3463962692], length 204
19:11:32.458121 IP 146.190.248.226.22 > 157.49.197.53.42950: Flags [P.], seq 1468:1708, ack 1, win 501, options [nop,nop,TS val 3594836027 ecr 3463962692], length 240
19:11:32.458168 IP 146.190.248.226.22 > 157.49.197.53.42950: Flags [P.], seq 1708:1744, ack 1, win 501, options [nop,nop,TS val 3594836028 ecr 3463962692], length 36
19:11:32.699695 IP 146.190.248.226.22 > 157.49.197.53.54364: Flags [P.], seq 1552447275:1552447319, ack 4084429181, win 3480, options [nop,nop,TS val 3594836269 ecr 3463962688], length 44
19:11:32.741474 IP 157.49.197.53.42950 > 146.190.248.226.22: Flags [.], ack 0, win 10343, options [nop,nop,TS val 3463962985 ecr 3594836021], length 0
19:11:32.741474 IP 157.49.197.53.42950 > 146.190.248.226.22: Flags [.], ack 108, win 10343, options [nop,nop,TS val 3463962993 ecr 3594836027], length 0
19:11:32.741587 IP 146.190.248.226.22 > 157.49.197.53.42950: Flags [P.], seq 1744:2728, ack 1, win 501, options [nop,nop,TS val 3594836311 ecr 3463962985], length 984
19:11:32.741964 IP 146.190.248.226.22 > 157.49.197.53.42950: Flags [P.], seq 2728:2916, ack 1, win 501, options [nop,nop,TS val 3594836311 ecr 3463962993], length 188
19:11:32.742049 IP 146.190.248.226.22 > 157.49.197.53.42950: Flags [P.], seq 2916:3140, ack 1, win 501, options [nop,nop,TS val 3594836311 ecr 3463962993], length 224
19:11:32.742099 IP 146.190.248.226.22 > 157.49.197.53.42950: Flags [P.], seq 3140:3176, ack 1, win 501, options [nop,nop,TS val 3594836311 ecr 3463962993], length 36
19:11:32.751241 IP 157.49.197.53.42950 > 146.190.248.226.22: Flags [.], ack 252, win 10342, options [nop,nop,TS val 3463962993 ecr 3594836027], length 0
19:11:32.751242 IP 157.49.197.53.42950 > 146.190.248.226.22: Flags [.], ack 288, win 10342, options [nop,nop,TS val 3463962993 ecr 3594836027], length 0
19:11:32.751242 IP 157.49.197.53.42950 > 146.190.248.226.22: Flags [.], ack 508, win 10341, options [nop,nop,TS val 3463962993 ecr 3594836027], length 0
19:11:32.751242 IP 157.49.197.53.42950 > 146.190.248.226.22: Flags [.], ack 988, win 10338, options [nop,nop,TS val 3463962993 ecr 3594836027], length 0
19:11:32.751242 IP 157.49.197.53.42950 > 146.190.248.226.22: Flags [.], ack 1264, win 10336, options [nop,nop,TS val 3463962993 ecr 3594836027], length 0
19:11:32.751242 IP 157.49.197.53.42950 > 146.190.248.226.22: Flags [.], ack 1468, win 10335, options [nop,nop,TS val 3463962993 ecr 3594836027], length 0
19:11:32.751242 IP 157.49.197.53.42950 > 146.190.248.226.22: Flags [.], ack 1708, win 10334, options [nop,nop,TS val 3463962993 ecr 3594836027], length 0
19:11:32.751242 IP 157.49.197.53.42950 > 146.190.248.226.22: Flags [.], ack 1744, win 10343, options [nop,nop,TS val 3463962993 ecr 3594836028], length 0
19:11:32.751338 IP 146.190.248.226.22 > 157.49.197.53.42950: Flags [P.], seq 3176:4136, ack 1, win 501, options [nop,nop,TS val 3594836321 ecr 3463962993], length 960
19:11:32.751544 IP 146.190.248.226.22 > 157.49.197.53.42950: Flags [P.], seq 4136:4324, ack 1, win 501, options [nop,nop,TS val 3594836321 ecr 3463962993], length 188
19:11:32.751636 IP 146.190.248.226.22 > 157.49.197.53.42950: Flags [P.], seq 4324:4548, ack 1, win 501, options [nop,nop,TS val 3594836321 ecr 3463962993], length 224
19:11:32.751720 IP 146.190.248.226.22 > 157.49.197.53.42950: Flags [P.], seq 4548:4772, ack 1, win 501, options [nop,nop,TS val 3594836321 ecr 3463962993], length 224
19:11:32.751774 IP 146.190.248.226.22 > 157.49.197.53.42950: Flags [P.], seq 4772:4808, ack 1, win 501, options [nop,nop,TS val 3594836321 ecr 3463962993], length 36
19:11:32.751791 IP 146.190.248.226.22 > 157.49.197.53.42950: Flags [P.], seq 4808:4996, ack 1, win 501, options [nop,nop,TS val 3594836321 ecr 3463962993], length 188
19:11:32.751828 IP 146.190.248.226.22 > 157.49.197.53.42950: Flags [P.], seq 4996:5032, ack 1, win 501, options [nop,nop,TS val 3594836321 ecr 3463962993], length 36
19:11:32.751872 IP 146.190.248.226.22 > 157.49.197.53.42950: Flags [P.], seq 5032:5220, ack 1, win 501, options [nop,nop,TS val 3594836321 ecr 3463962993], length 188
19:11:32.751937 IP 146.190.248.226.22 > 157.49.197.53.42950: Flags [P.], seq 5220:5444, ack 1, win 501, options [nop,nop,TS val 3594836321 ecr 3463962993], length 224
19:11:32.752002 IP 146.190.248.226.22 > 157.49.197.53.42950: Flags [P.], seq 5444:5480, ack 1, win 501, options [nop,nop,TS val 3594836321 ecr 3463962993], length 36
19:11:32.752036 IP 146.190.248.226.22 > 157.49.197.53.42950: Flags [P.], seq 5480:5668, ack 1, win 501, options [nop,nop,TS val 3594836321 ecr 3463962993], length 188
19:11:32.752092 IP 146.190.248.226.22 > 157.49.197.53.42950: Flags [P.], seq 5668:5704, ack 1, win 501, options [nop,nop,TS val 3594836321 ecr 3463962993], length 36
19:11:32.752119 IP 146.190.248.226.22 > 157.49.197.53.42950: Flags [P.], seq 5704:5892, ack 1, win 501, options [nop,nop,TS val 3594836321 ecr 3463962993], length 188
19:11:32.752174 IP 146.190.248.226.22 > 157.49.197.53.42950: Flags [P.], seq 5892:6132, ack 1, win 501, options [nop,nop,TS val 3594836322 ecr 3463962993], length 240
19:11:32.752227 IP 146.190.248.226.22 > 157.49.197.53.42950: Flags [P.], seq 6132:6168, ack 1, win 501, options [nop,nop,TS val 3594836322 ecr 3463962993], length 36
19:11:32.752254 IP 146.190.248.226.22 > 157.49.197.53.42950: Flags [P.], seq 6168:6372, ack 1, win 501, options [nop,nop,TS val 3594836322 ecr 3463962993], length 204
19:11:33.211404 IP 157.49.197.53.42950 > 146.190.248.226.22: Flags [.], ack 2728, win 10344, options [nop,nop,TS val 3463963453 ecr 3594836311], length 0
19:11:33.211470 IP 146.190.248.226.22 > 157.49.197.53.42950: Flags [P.], seq 6372:9088, ack 1, win 501, options [nop,nop,TS val 3594836781 ecr 3463963453], length 2716
19:11:33.214141 IP 157.49.197.53.54364 > 146.190.248.226.22: Flags [.], ack 44, win 6365, options [nop,nop,TS val 3463963453 ecr 3594836269], length 0
19:11:33.221431 IP 157.49.197.53.42950 > 146.190.248.226.22: Flags [.], ack 2916, win 10343, options [nop,nop,TS val 3463963453 ecr 3594836311], length 0
19:11:33.221432 IP 157.49.197.53.42950 > 146.190.248.226.22: Flags [.], ack 3140, win 10342, options [nop,nop,TS val 3463963453 ecr 3594836311], length 0
19:11:33.221432 IP 157.49.197.53.42950 > 146.190.248.226.22: Flags [.], ack 3176, win 10342, options [nop,nop,TS val 3463963453 ecr 3594836311], length 0
19:11:33.221432 IP 157.49.197.53.42950 > 146.190.248.226.22: Flags [.], ack 4136, win 10335, options [nop,nop,TS val 3463963453 ecr 3594836321], length 0
19:11:33.221432 IP 157.49.197.53.42950 > 146.190.248.226.22: Flags [.], ack 4324, win 10334, options [nop,nop,TS val 3463963453 ecr 3594836321], length 0
19:11:33.221432 IP 157.49.197.53.42950 > 146.190.248.226.22: Flags [.], ack 4548, win 10333, options [nop,nop,TS val 3463963453 ecr 3594836321], length 0
19:11:33.221432 IP 157.49.197.53.42950 > 146.190.248.226.22: Flags [.], ack 5668, win 10344, options [nop,nop,TS val 3463963453 ecr 3594836321], length 0
19:11:33.221522 IP 146.190.248.226.22 > 157.49.197.53.42950: Flags [P.], seq 9088:10456, ack 1, win 501, options [nop,nop,TS val 3594836791 ecr 3463963453], length 1368
19:11:33.221586 IP 157.49.197.53.42950 > 146.190.248.226.22: Flags [.], ack 6372, win 10344, options [nop,nop,TS val 3463963454 ecr 3594836321], length 0
19:11:33.221948 IP 146.190.248.226.22 > 157.49.197.53.42950: Flags [P.], seq 10456:10644, ack 1, win 501, options [nop,nop,TS val 3594836791 ecr 3463963454], length 188
19:11:33.222029 IP 146.190.248.226.22 > 157.49.197.53.42950: Flags [P.], seq 10644:10868, ack 1, win 501, options [nop,nop,TS val 3594836791 ecr 3463963454], length 224
19:11:33.222092 IP 146.190.248.226.22 > 157.49.197.53.42950: Flags [P.], seq 10868:11092, ack 1, win 501, options [nop,nop,TS val 3594836791 ecr 3463963454], length 224
19:11:33.222143 IP 146.190.248.226.22 > 157.49.197.53.42950: Flags [P.], seq 11092:11316, ack 1, win 501, options [nop,nop,TS val 3594836792 ecr 3463963454], length 224
19:11:33.222194 IP 146.190.248.226.22 > 157.49.197.53.42950: Flags [P.], seq 11316:11540, ack 1, win 501, options [nop,nop,TS val 3594836792 ecr 3463963454], length 224
19:11:33.222248 IP 146.190.248.226.22 > 157.49.197.53.42950: Flags [P.], seq 11540:11764, ack 1, win 501, options [nop,nop,TS val 3594836792 ecr 3463963454], length 224
19:11:33.222297 IP 146.190.248.226.22 > 157.49.197.53.42950: Flags [P.], seq 11764:11800, ack 1, win 501, options [nop,nop,TS val 3594836792 ecr 3463963454], length 36
19:11:33.222320 IP 146.190.248.226.22 > 157.49.197.53.42950: Flags [P.], seq 11800:11988, ack 1, win 501, options [nop,nop,TS val 3594836792 ecr 3463963454], length 188
19:11:33.222378 IP 146.190.248.226.22 > 157.49.197.53.42950: Flags [P.], seq 11988:12024, ack 1, win 501, options [nop,nop,TS val 3594836792 ecr 3463963454], length 36
19:11:33.222415 IP 146.190.248.226.22 > 157.49.197.53.42950: Flags [P.], seq 12024:12228, ack 1, win 501, options [nop,nop,TS val 3594836792 ecr 3463963454], length 204
19:11:33.222463 IP 146.190.248.226.22 > 157.49.197.53.42950: Flags [P.], seq 12228:12264, ack 1, win 501, options [nop,nop,TS val 3594836792 ecr 3463963454], length 36
19:11:33.222493 IP 146.190.248.226.22 > 157.49.197.53.42950: Flags [P.], seq 12264:12452, ack 1, win 501, options [nop,nop,TS val 3594836792 ecr 3463963454], length 188
19:11:33.222545 IP 146.190.248.226.22 > 157.49.197.53.42950: Flags [P.], seq 12452:12692, ack 1, win 501, options [nop,nop,TS val 3594836792 ecr 3463963454], length 240
19:11:33.222592 IP 146.190.248.226.22 > 157.49.197.53.42950: Flags [P.], seq 12692:12728, ack 1, win 501, options [nop,nop,TS val 3594836792 ecr 3463963454], length 36
19:11:33.222605 IP 146.190.248.226.22 > 157.49.197.53.42950: Flags [P.], seq 12728:12932, ack 1, win 501, options [nop,nop,TS val 3594836792 ecr 3463963454], length 204
19:11:33.222642 IP 146.190.248.226.22 > 157.49.197.53.42950: Flags [P.], seq 12932:12968, ack 1, win 501, options [nop,nop,TS val 3594836792 ecr 3463963454], length 36
19:11:33.222681 IP 146.190.248.226.22 > 157.49.197.53.42950: Flags [P.], seq 12968:13172, ack 1, win 501, options [nop,nop,TS val 3594836792 ecr 3463963454], length 204
19:11:33.222711 IP 146.190.248.226.22 > 157.49.197.53.42950: Flags [P.], seq 13172:13208, ack 1, win 501, options [nop,nop,TS val 3594836792 ecr 3463963454], length 36
19:11:33.222745 IP 146.190.248.226.22 > 157.49.197.53.42950: Flags [P.], seq 13208:13412, ack 1, win 501, options [nop,nop,TS val 3594836792 ecr 3463963454], length 204
19:11:33.222801 IP 146.190.248.226.22 > 157.49.197.53.42950: Flags [P.], seq 13412:13448, ack 1, win 501, options [nop,nop,TS val 3594836792 ecr 3463963454], length 36
19:11:33.222816 IP 146.190.248.226.22 > 157.49.197.53.42950: Flags [P.], seq 13448:13652, ack 1, win 501, options [nop,nop,TS val 3594836792 ecr 3463963454], length 204
19:11:33.222843 IP 146.190.248.226.22 > 157.49.197.53.42950: Flags [P.], seq 13652:13688, ack 1, win 501, options [nop,nop,TS val 3594836792 ecr 3463963454], length 36
19:11:33.222874 IP 146.190.248.226.22 > 157.49.197.53.42950: Flags [P.], seq 13688:13892, ack 1, win 501, options [nop,nop,TS val 3594836792 ecr 3463963454], length 204
19:11:33.222903 IP 146.190.248.226.22 > 157.49.197.53.42950: Flags [P.], seq 13892:13928, ack 1, win 501, options [nop,nop,TS val 3594836792 ecr 3463963454], length 36
19:11:33.222933 IP 146.190.248.226.22 > 157.49.197.53.42950: Flags [P.], seq 13928:14132, ack 1, win 501, options [nop,nop,TS val 3594836792 ecr 3463963454], length 204
19:11:33.222967 IP 146.190.248.226.22 > 157.49.197.53.42950: Flags [P.], seq 14132:14168, ack 1, win 501, options [nop,nop,TS val 3594836792 ecr 3463963454], length 36
19:11:33.223000 IP 146.190.248.226.22 > 157.49.197.53.42950: Flags [P.], seq 14168:14372, ack 1, win 501, options [nop,nop,TS val 3594836792 ecr 3463963454], length 204
19:11:33.223036 IP 146.190.248.226.22 > 157.49.197.53.42950: Flags [P.], seq 14372:14408, ack 1, win 501, options [nop,nop,TS val 3594836792 ecr 3463963454], length 36
19:11:33.223070 IP 146.190.248.226.22 > 157.49.197.53.42950: Flags [P.], seq 14408:14648, ack 1, win 501, options [nop,nop,TS val 3594836792 ecr 3463963454], length 240
19:11:33.223104 IP 146.190.248.226.22 > 157.49.197.53.42950: Flags [P.], seq 14648:14852, ack 1, win 501, options [nop,nop,TS val 3594836792 ecr 3463963454], length 204
19:11:33.223139 IP 146.190.248.226.22 > 157.49.197.53.42950: Flags [P.], seq 14852:14888, ack 1, win 501, options [nop,nop,TS val 3594836793 ecr 3463963454], length 36
19:11:33.223173 IP 146.190.248.226.22 > 157.49.197.53.42950: Flags [P.], seq 14888:15128, ack 1, win 501, options [nop,nop,TS val 3594836793 ecr 3463963454], length 240
19:11:33.223251 IP 146.190.248.226.22 > 157.49.197.53.42950: Flags [P.], seq 15128:15368, ack 1, win 501, options [nop,nop,TS val 3594836793 ecr 3463963454], length 240
19:11:33.223303 IP 146.190.248.226.22 > 157.49.197.53.42950: Flags [P.], seq 15368:15608, ack 1, win 501, options [nop,nop,TS val 3594836793 ecr 3463963454], length 240
19:11:33.223354 IP 146.190.248.226.22 > 157.49.197.53.42950: Flags [P.], seq 15608:15848, ack 1, win 501, options [nop,nop,TS val 3594836793 ecr 3463963454], length 240
19:11:33.223407 IP 146.190.248.226.22 > 157.49.197.53.42950: Flags [P.], seq 15848:16052, ack 1, win 501, options [nop,nop,TS val 3594836793 ecr 3463963454], length 204
19:11:33.224508 IP 157.49.197.53.54364 > 146.190.248.226.22: Flags [P.], seq 1:61, ack 44, win 6365, options [nop,nop,TS val 3463963458 ecr 3594836269], length 60
19:11:33.224552 IP 146.190.248.226.22 > 157.49.197.53.54364: Flags [.], ack 61, win 3480, options [nop,nop,TS val 3594836794 ecr 3463963458], length 0
19:11:33.226801 IP 146.190.248.226.22 > 157.49.197.53.54364: Flags [P.], seq 44:104, ack 61, win 3480, options [nop,nop,TS val 3594836796 ecr 3463963458], length 60
19:11:33.622288 IP 51.79.237.136.40709 > 146.190.248.226.26539: Flags [S], seq 23390, win 512, length 0
19:11:33.700005 IP 146.190.248.226.22 > 157.49.197.53.54364: Flags [P.], seq 104:148, ack 61, win 3480, options [nop,nop,TS val 3594837269 ecr 3463963458], length 44
19:11:33.711446 IP 157.49.197.53.42950 > 146.190.248.226.22: Flags [.], ack 10868, win 10344, options [nop,nop,TS val 3463963965 ecr 3594836781], length 0
19:11:33.711447 IP 157.49.197.53.42950 > 146.190.248.226.22: Flags [.], ack 11316, win 10344, options [nop,nop,TS val 3463963965 ecr 3594836791], length 0
19:11:33.711530 IP 146.190.248.226.22 > 157.49.197.53.42950: Flags [P.], seq 16052:18768, ack 1, win 501, options [nop,nop,TS val 3594837281 ecr 3463963965], length 2716
19:11:33.711555 IP 146.190.248.226.22 > 157.49.197.53.42950: Flags [P.], seq 18768:21484, ack 1, win 501, options [nop,nop,TS val 3594837281 ecr 3463963965], length 2716
19:11:33.711629 IP 146.190.248.226.22 > 157.49.197.53.42950: Flags [P.], seq 21484:22240, ack 1, win 501, options [nop,nop,TS val 3594837281 ecr 3463963965], length 756
19:11:33.711738 IP 146.190.248.226.22 > 157.49.197.53.42950: Flags [P.], seq 22240:22428, ack 1, win 501, options [nop,nop,TS val 3594837281 ecr 3463963965], length 188
19:11:33.711815 IP 146.190.248.226.22 > 157.49.197.53.42950: Flags [P.], seq 22428:22652, ack 1, win 501, options [nop,nop,TS val 3594837281 ecr 3463963965], length 224
19:11:33.711923 IP 146.190.248.226.22 > 157.49.197.53.42950: Flags [P.], seq 22652:23132, ack 1, win 501, options [nop,nop,TS val 3594837281 ecr 3463963965], length 480
19:11:33.711975 IP 146.190.248.226.22 > 157.49.197.53.42950: Flags [P.], seq 23132:23168, ack 1, win 501, options [nop,nop,TS val 3594837281 ecr 3463963965], length 36
19:11:33.712010 IP 146.190.248.226.22 > 157.49.197.53.42950: Flags [P.], seq 23168:23372, ack 1, win 501, options [nop,nop,TS val 3594837281 ecr 3463963965], length 204
19:11:33.712055 IP 146.190.248.226.22 > 157.49.197.53.42950: Flags [P.], seq 23372:23408, ack 1, win 501, options [nop,nop,TS val 3594837281 ecr 3463963965], length 36
19:11:33.712094 IP 146.190.248.226.22 > 157.49.197.53.42950: Flags [P.], seq 23408:23612, ack 1, win 501, options [nop,nop,TS val 3594837281 ecr 3463963965], length 204
19:11:33.712140 IP 146.190.248.226.22 > 157.49.197.53.42950: Flags [P.], seq 23612:23648, ack 1, win 501, options [nop,nop,TS val 3594837282 ecr 3463963965], length 36
19:11:33.712162 IP 146.190.248.226.22 > 157.49.197.53.42950: Flags [P.], seq 23648:23852, ack 1, win 501, options [nop,nop,TS val 3594837282 ecr 3463963965], length 204
19:11:33.712222 IP 146.190.248.226.22 > 157.49.197.53.42950: Flags [P.], seq 23852:24092, ack 1, win 501, options [nop,nop,TS val 3594837282 ecr 3463963965], length 240
19:11:33.712255 IP 146.190.248.226.22 > 157.49.197.53.42950: Flags [P.], seq 24092:24128, ack 1, win 501, options [nop,nop,TS val 3594837282 ecr 3463963965], length 36
19:11:33.724402 IP 157.49.197.53.54364 > 146.190.248.226.22: Flags [P.], seq 1:61, ack 44, win 6365, options [nop,nop,TS val 3463963950 ecr 3594836269], length 60
19:11:33.724478 IP 146.190.248.226.22 > 157.49.197.53.54364: Flags [.], ack 61, win 3480, options [nop,nop,TS val 3594837294 ecr 3463963950,nop,nop,sack 1 {1:61}], length 0
19:11:33.734331 IP 157.49.197.53.42950 > 146.190.248.226.22: Flags [.], ack 12452, win 10344, options [nop,nop,TS val 3463963969 ecr 3594836792], length 0
19:11:33.734332 IP 157.49.197.53.42950 > 146.190.248.226.22: Flags [.], ack 13448, win 10344, options [nop,nop,TS val 3463963969 ecr 3594836792], length 0
19:11:33.734332 IP 157.49.197.53.42950 > 146.190.248.226.22: Flags [.], ack 14132, win 10341, options [nop,nop,TS val 3463963969 ecr 3594836792], length 0
19:11:33.734332 IP 157.49.197.53.42950 > 146.190.248.226.22: Flags [.], ack 14372, win 10344, options [nop,nop,TS val 3463963969 ecr 3594836792], length 0
19:11:33.734332 IP 157.49.197.53.42950 > 146.190.248.226.22: Flags [.], ack 15608, win 10344, options [nop,nop,TS val 3463963973 ecr 3594836792], length 0
19:11:33.734332 IP 157.49.197.53.42950 > 146.190.248.226.22: Flags [.], ack 15848, win 10344, options [nop,nop,TS val 3463963973 ecr 3594836793], length 0
19:11:33.734332 IP 157.49.197.53.42950 > 146.190.248.226.22: Flags [.], ack 16052, win 10344, options [nop,nop,TS val 3463963973 ecr 3594836793], length 0
19:11:33.734423 IP 146.190.248.226.22 > 157.49.197.53.42950: Flags [P.], seq 24128:26528, ack 1, win 501, options [nop,nop,TS val 3594837304 ecr 3463963969], length 2400
19:11:33.734632 IP 146.190.248.226.22 > 157.49.197.53.42950: Flags [P.], seq 26528:26716, ack 1, win 501, options [nop,nop,TS val 3594837304 ecr 3463963973], length 188
19:11:33.734712 IP 146.190.248.226.22 > 157.49.197.53.42950: Flags [P.], seq 26716:26940, ack 1, win 501, options [nop,nop,TS val 3594837304 ecr 3463963973], length 224
19:11:33.734765 IP 146.190.248.226.22 > 157.49.197.53.42950: Flags [P.], seq 26940:26976, ack 1, win 501, options [nop,nop,TS val 3594837304 ecr 3463963973], length 36
19:11:33.734805 IP 146.190.248.226.22 > 157.49.197.53.42950: Flags [P.], seq 26976:27164, ack 1, win 501, options [nop,nop,TS val 3594837304 ecr 3463963973], length 188
19:11:33.734872 IP 146.190.248.226.22 > 157.49.197.53.42950: Flags [P.], seq 27164:27388, ack 1, win 501, options [nop,nop,TS val 3594837304 ecr 3463963973], length 224
19:11:33.734953 IP 146.190.248.226.22 > 157.49.197.53.42950: Flags [P.], seq 27388:27648, ack 1, win 501, options [nop,nop,TS val 3594837304 ecr 3463963973], length 260
19:11:33.735042 IP 146.190.248.226.22 > 157.49.197.53.42950: Flags [P.], seq 27648:28060, ack 1, win 501, options [nop,nop,TS val 3594837304 ecr 3463963973], length 412
19:11:33.735115 IP 146.190.248.226.22 > 157.49.197.53.42950: Flags [P.], seq 28060:28300, ack 1, win 501, options [nop,nop,TS val 3594837304 ecr 3463963973], length 240
19:11:33.735173 IP 146.190.248.226.22 > 157.49.197.53.42950: Flags [P.], seq 28300:28336, ack 1, win 501, options [nop,nop,TS val 3594837305 ecr 3463963973], length 36
19:11:33.735197 IP 146.190.248.226.22 > 157.49.197.53.42950: Flags [P.], seq 28336:28540, ack 1, win 501, options [nop,nop,TS val 3594837305 ecr 3463963973], length 204
19:11:33.735260 IP 146.190.248.226.22 > 157.49.197.53.42950: Flags [P.], seq 28540:28576, ack 1, win 501, options [nop,nop,TS val 3594837305 ecr 3463963973], length 36
19:11:33.735278 IP 146.190.248.226.22 > 157.49.197.53.42950: Flags [P.], seq 28576:28780, ack 1, win 501, options [nop,nop,TS val 3594837305 ecr 3463963973], length 204
19:11:33.735344 IP 146.190.248.226.22 > 157.49.197.53.42950: Flags [P.], seq 28780:29020, ack 1, win 501, options [nop,nop,TS val 3594837305 ecr 3463963973], length 240
19:11:33.735398 IP 146.190.248.226.22 > 157.49.197.53.42950: Flags [P.], seq 29020:29056, ack 1, win 501, options [nop,nop,TS val 3594837305 ecr 3463963973], length 36
19:11:33.735433 IP 146.190.248.226.22 > 157.49.197.53.42950: Flags [P.], seq 29056:29260, ack 1, win 501, options [nop,nop,TS val 3594837305 ecr 3463963973], length 204
19:11:33.735488 IP 146.190.248.226.22 > 157.49.197.53.42950: Flags [P.], seq 29260:29296, ack 1, win 501, options [nop,nop,TS val 3594837305 ecr 3463963973], length 36
19:11:33.735521 IP 146.190.248.226.22 > 157.49.197.53.42950: Flags [P.], seq 29296:29500, ack 1, win 501, options [nop,nop,TS val 3594837305 ecr 3463963973], length 204
19:11:33.735575 IP 146.190.248.226.22 > 157.49.197.53.42950: Flags [P.], seq 29500:29536, ack 1, win 501, options [nop,nop,TS val 3594837305 ecr 3463963973], length 36
19:11:33.735610 IP 146.190.248.226.22 > 157.49.197.53.42950: Flags [P.], seq 29536:29740, ack 1, win 501, options [nop,nop,TS val 3594837305 ecr 3463963973], length 204
19:11:33.735663 IP 146.190.248.226.22 > 157.49.197.53.42950: Flags [P.], seq 29740:29776, ack 1, win 501, options [nop,nop,TS val 3594837305 ecr 3463963973], length 36
19:11:33.735702 IP 146.190.248.226.22 > 157.49.197.53.42950: Flags [P.], seq 29776:29980, ack 1, win 501, options [nop,nop,TS val 3594837305 ecr 3463963973], length 204
19:11:33.735768 IP 146.190.248.226.22 > 157.49.197.53.42950: Flags [P.], seq 29980:30016, ack 1, win 501, options [nop,nop,TS val 3594837305 ecr 3463963973], length 36
19:11:33.735787 IP 146.190.248.226.22 > 157.49.197.53.42950: Flags [P.], seq 30016:30220, ack 1, win 501, options [nop,nop,TS val 3594837305 ecr 3463963973], length 204
19:11:33.735935 IP 146.190.248.226.22 > 157.49.197.53.42950: Flags [P.], seq 30220:30700, ack 1, win 501, options [nop,nop,TS val 3594837305 ecr 3463963973], length 480
19:11:33.735985 IP 146.190.248.226.22 > 157.49.197.53.42950: Flags [P.], seq 30700:30736, ack 1, win 501, options [nop,nop,TS val 3594837305 ecr 3463963973], length 36
19:11:33.736006 IP 146.190.248.226.22 > 157.49.197.53.42950: Flags [P.], seq 30736:30940, ack 1, win 501, options [nop,nop,TS val 3594837305 ecr 3463963973], length 204
19:11:33.736074 IP 146.190.248.226.22 > 157.49.197.53.42950: Flags [P.], seq 30940:31180, ack 1, win 501, options [nop,nop,TS val 3594837305 ecr 3463963973], length 240
19:11:33.736131 IP 146.190.248.226.22 > 157.49.197.53.42950: Flags [P.], seq 31180:31216, ack 1, win 501, options [nop,nop,TS val 3594837306 ecr 3463963973], length 36
19:11:33.736174 IP 146.190.248.226.22 > 157.49.197.53.42950: Flags [P.], seq 31216:31420, ack 1, win 501, options [nop,nop,TS val 3594837306 ecr 3463963973], length 204
19:11:33.736210 IP 146.190.248.226.22 > 157.49.197.53.42950: Flags [P.], seq 31420:31456, ack 1, win 501, options [nop,nop,TS val 3594837306 ecr 3463963973], length 36
19:11:33.736259 IP 146.190.248.226.22 > 157.49.197.53.42950: Flags [P.], seq 31456:31660, ack 1, win 501, options [nop,nop,TS val 3594837306 ecr 3463963973], length 204
19:11:33.736316 IP 146.190.248.226.22 > 157.49.197.53.42950: Flags [P.], seq 31660:31696, ack 1, win 501, options [nop,nop,TS val 3594837306 ecr 3463963973], length 36
19:11:33.736343 IP 146.190.248.226.22 > 157.49.197.53.42950: Flags [P.], seq 31696:31900, ack 1, win 501, options [nop,nop,TS val 3594837306 ecr 3463963973], length 204
19:11:33.736402 IP 146.190.248.226.22 > 157.49.197.53.42950: Flags [P.], seq 31900:31936, ack 1, win 501, options [nop,nop,TS val 3594837306 ecr 3463963973], length 36
19:11:33.736415 IP 146.190.248.226.22 > 157.49.197.53.42950: Flags [P.], seq 31936:32140, ack 1, win 501, options [nop,nop,TS val 3594837306 ecr 3463963973], length 204
19:11:33.736447 IP 146.190.248.226.22 > 157.49.197.53.42950: Flags [P.], seq 32140:32176, ack 1, win 501, options [nop,nop,TS val 3594837306 ecr 3463963973], length 36
19:11:33.736478 IP 146.190.248.226.22 > 157.49.197.53.42950: Flags [P.], seq 32176:32380, ack 1, win 501, options [nop,nop,TS val 3594837306 ecr 3463963973], length 204
19:11:33.736506 IP 146.190.248.226.22 > 157.49.197.53.42950: Flags [P.], seq 32380:32416, ack 1, win 501, options [nop,nop,TS val 3594837306 ecr 3463963973], length 36
19:11:33.736538 IP 146.190.248.226.22 > 157.49.197.53.42950: Flags [P.], seq 32416:32620, ack 1, win 501, options [nop,nop,TS val 3594837306 ecr 3463963973], length 204
19:11:33.736569 IP 146.190.248.226.22 > 157.49.197.53.42950: Flags [P.], seq 32620:32656, ack 1, win 501, options [nop,nop,TS val 3594837306 ecr 3463963973], length 36
19:11:33.736618 IP 146.190.248.226.22 > 157.49.197.53.42950: Flags [P.], seq 32656:32860, ack 1, win 501, options [nop,nop,TS val 3594837306 ecr 3463963973], length 204
19:11:33.736668 IP 146.190.248.226.22 > 157.49.197.53.42950: Flags [P.], seq 32860:32896, ack 1, win 501, options [nop,nop,TS val 3594837306 ecr 3463963973], length 36
19:11:33.736711 IP 146.190.248.226.22 > 157.49.197.53.42950: Flags [P.], seq 32896:33100, ack 1, win 501, options [nop,nop,TS val 3594837306 ecr 3463963973], length 204
19:11:33.736783 IP 146.190.248.226.22 > 157.49.197.53.42950: Flags [P.], seq 33100:33340, ack 1, win 501, options [nop,nop,TS val 3594837306 ecr 3463963973], length 240
19:11:33.736847 IP 146.190.248.226.22 > 157.49.197.53.42950: Flags [P.], seq 33340:33376, ack 1, win 501, options [nop,nop,TS val 3594837306 ecr 3463963973], length 36
19:11:33.736871 IP 146.190.248.226.22 > 157.49.197.53.42950: Flags [P.], seq 33376:33580, ack 1, win 501, options [nop,nop,TS val 3594837306 ecr 3463963973], length 204
19:11:33.736994 IP 146.190.248.226.22 > 157.49.197.53.42950: Flags [P.], seq 33580:34060, ack 1, win 501, options [nop,nop,TS val 3594837306 ecr 3463963973], length 480
19:11:33.737052 IP 146.190.248.226.22 > 157.49.197.53.42950: Flags [P.], seq 34060:34096, ack 1, win 501, options [nop,nop,TS val 3594837306 ecr 3463963973], length 36
19:11:33.737082 IP 146.190.248.226.22 > 157.49.197.53.42950: Flags [P.], seq 34096:34300, ack 1, win 501, options [nop,nop,TS val 3594837306 ecr 3463963973], length 204
19:11:33.737141 IP 146.190.248.226.22 > 157.49.197.53.42950: Flags [P.], seq 34300:34336, ack 1, win 501, options [nop,nop,TS val 3594837307 ecr 3463963973], length 36
19:11:33.737160 IP 146.190.248.226.22 > 157.49.197.53.42950: Flags [P.], seq 34336:34540, ack 1, win 501, options [nop,nop,TS val 3594837307 ecr 3463963973], length 204
19:11:33.737189 IP 146.190.248.226.22 > 157.49.197.53.42950: Flags [P.], seq 34540:34576, ack 1, win 501, options [nop,nop,TS val 3594837307 ecr 3463963973], length 36
19:11:33.737333 IP 146.190.248.226.22 > 157.49.197.53.42950: Flags [P.], seq 34576:34780, ack 1, win 501, options [nop,nop,TS val 3594837307 ecr 3463963973], length 204
19:11:33.737385 IP 146.190.248.226.22 > 157.49.197.53.42950: Flags [P.], seq 34780:34816, ack 1, win 501, options [nop,nop,TS val 3594837307 ecr 3463963973], length 36
19:11:33.737430 IP 146.190.248.226.22 > 157.49.197.53.42950: Flags [P.], seq 34816:35020, ack 1, win 501, options [nop,nop,TS val 3594837307 ecr 3463963973], length 204
19:11:33.737479 IP 146.190.248.226.22 > 157.49.197.53.42950: Flags [P.], seq 35020:35056, ack 1, win 501, options [nop,nop,TS val 3594837307 ecr 3463963973], length 36
19:11:33.737500 IP 146.190.248.226.22 > 157.49.197.53.42950: Flags [P.], seq 35056:35260, ack 1, win 501, options [nop,nop,TS val 3594837307 ecr 3463963973], length 204
19:11:33.737563 IP 146.190.248.226.22 > 157.49.197.53.42950: Flags [P.], seq 35260:35500, ack 1, win 501, options [nop,nop,TS val 3594837307 ecr 3463963973], length 240
19:11:33.737638 IP 146.190.248.226.22 > 157.49.197.53.42950: Flags [P.], seq 35500:35536, ack 1, win 501, options [nop,nop,TS val 3594837307 ecr 3463963973], length 36
19:11:33.737878 IP 146.190.248.226.22 > 157.49.197.53.42950: Flags [P.], seq 35536:35740, ack 1, win 501, options [nop,nop,TS val 3594837307 ecr 3463963973], length 204
19:11:33.737972 IP 146.190.248.226.22 > 157.49.197.53.42950: Flags [P.], seq 35740:35980, ack 1, win 501, options [nop,nop,TS val 3594837307 ecr 3463963973], length 240
19:11:33.738057 IP 146.190.248.226.22 > 157.49.197.53.42950: Flags [P.], seq 35980:36256, ack 1, win 501, options [nop,nop,TS val 3594837307 ecr 3463963973], length 276
